{
  "userId": "gaiabot",
  "updatedAt": "2026-04-26",
  "unlockedSkills": [
    {
      "skillId": "route-intent",
      "level": "II",
      "unlockedAt": "2026-04-20",
      "unlockedIn": "gaia-registry/gaiabot-core",
      "combinedFrom": []
    },
    {
      "skillId": "plan-decompose",
      "level": "II",
      "unlockedAt": "2026-04-21",
      "unlockedIn": "gaia-registry/gaiabot-core",
      "combinedFrom": []
    },
    {
      "skillId": "tool-select",
      "level": "II",
      "unlockedAt": "2026-04-22",
      "unlockedIn": "gaia-registry/gaiabot-core",
      "combinedFrom": []
    },
    {
      "skillId": "plan-and-execute",
      "level": "III",
      "unlockedAt": "2026-04-26",
      "unlockedIn": "local-repo",
      "combinedFrom": [
        "route-intent",
        "plan-decompose",
        "tool-select"
      ]
    }
  ],
  "pendingCombinations": [],
  "stats": {
    "totalUnlocked": 4,
    "highestRarity": "common",
    "deepestLineage": 1
  }
}
