{
  "userId": "mbtiongson1",
  "updatedAt": "2026-04-26",
  "unlockedSkills": [
    {
      "skillId": "web-search",
      "level": "II",
      "unlockedAt": "2026-03-01",
      "unlockedIn": "mbtiongson1/gaia-skill-tree",
      "combinedFrom": []
    },
    {
      "skillId": "parse-html",
      "level": "II",
      "unlockedAt": "2026-03-05",
      "unlockedIn": "mbtiongson1/gaia-skill-tree",
      "combinedFrom": []
    },
    {
      "skillId": "extract-entities",
      "level": "II",
      "unlockedAt": "2026-03-08",
      "unlockedIn": "mbtiongson1/gaia-skill-tree",
      "combinedFrom": []
    },
    {
      "skillId": "summarize",
      "level": "II",
      "unlockedAt": "2026-03-10",
      "unlockedIn": "mbtiongson1/gaia-skill-tree",
      "combinedFrom": []
    },
    {
      "skillId": "cite-sources",
      "level": "II",
      "unlockedAt": "2026-03-12",
      "unlockedIn": "mbtiongson1/gaia-skill-tree",
      "combinedFrom": []
    },
    {
      "skillId": "web-scrape",
      "level": "III",
      "unlockedAt": "2026-03-15",
      "unlockedIn": "mbtiongson1/gaia-skill-tree",
      "combinedFrom": [
        "web-search",
        "parse-html",
        "extract-entities"
      ]
    },
    {
      "skillId": "research",
      "level": "III",
      "unlockedAt": "2026-04-01",
      "unlockedIn": "mbtiongson1/gaia-skill-tree",
      "combinedFrom": [
        "web-search",
        "summarize",
        "cite-sources"
      ]
    }
  ],
  "pendingCombinations": [
    {
      "detectedSkills": [
        "code-generation",
        "execute-bash",
        "error-interpretation"
      ],
      "candidateResult": "autonomous-debug",
      "levelFloor": "III",
      "promptedAt": "2026-04-26"
    }
  ],
  "stats": {
    "totalUnlocked": 7,
    "highestRarity": "uncommon",
    "deepestLineage": 2
  }
}
